Title,Year,Abstract
Combined applications of biochar and legume residues to improve growth and yield of sweet potato in a dry land area of East Java,2015,"Production of sweet potato in the dry land areas of East Java is low because of low levels of
soil fertility in the region. One of alternatives to improve crop production in the area is the use …"
Management Local Area Network (Case Study at Assessment and Development of Information Technology Units Brawijaya University Malang).,2015,"… Universitas Brawijaya. PPTI memegang bagian vital dalam teknologi informasi di Universitas
Brawijaya … tugas untuk mengelola bisnis Universitas Brawijaya yang terkait dengan …"
[PDF] The possible use of coal fly ash and phosphate-solubilizing fungi for improving the availability of P and plant growth in acid soil,2020,"The availability of P in acid soils may be raised through the application of phosphatesolubilizing
fungi (PSF). Coal fly ash (CFA) that has a high pH and contains a relatively high P may …"
[PDF] Investigation of the spread of mercury in the land around the waste storage ponds in the Kulon Progo traditional gold mine,2021,"Article history: Received 19 April 2021 Accepted 11 May 2021 Published 1 July 2021 This
study was conducted to determine mercury contamination contained in soils in Kalirejo sub-…"
"Challenging the elite-public divide; Representing former Indonesian first lady, Ani Yudhoyono in online news discourse",2023,"Women in politics invariably attract heightened levels of attention due to their marked difference
to the masculine political norm. With the rise of social media and online news, political …"
The roles of arbuscular mycorrhizal fungi in the intensity of the foot rot disease on pepper plant from the infected soil,2017,"Pepper (Piper nigrum L.) is an important spice plant of Indonesia. In Bangka Belitung Province,
the main pepper producer, pepper has been the most commonly cultivated commodity. …"
The quantitative soil quality assessment for tobacco plant in Sindoro mountainous zone,2014,"The long-term cultivation of tobacco (Nicotiana tabacum) plant in the Sindoro mountainous
zone of Central Java has resulted in soil quality degradation that could affect economic …"
Water and sediment yields from two catchments with different land cover areas,2017,"Land cover and human activities affect water yield and soil erosion-sedimentation in a
catchment. Therefore, a study to obtain information of water and sediment yields from two …"
"THE IMPACT OF BRAND EQUITY TOWARDS CONSUMER'S PURCHASE INTENTION (An Empirical Study of Teh Botol Sosro Product, on College Student in Faculty …",2016,"… Sampel dalam penelitian ini adalah siswa di Fakultas Ekonomi dan Bisnis Universitas
Brawijaya (UB) Malang. Teknik pengambilan sampel adalah purposive sampling dengan 120 …"
The effectiveness of Mendong plant (Fimbrystilis globulosa) as a phytoremediator of soil contaminated with chromium of industrial waste,2017,"The textile industry produces sideline output in the form of dangerous waste. The textile
industrial waste containing heavy metal, one of which is Chromium (Cr). Chromium is very …"
[PDF] A Flavonoid glycoside compound isolated from Macaranga gigantifolia Merr leaves,2017,"Apigenin-8-C-glycoside (1), a flavonoid glycoside compound has been isolated from the
leaves of Macaranga gigantifolia Merr. Isolation and purification was conducted by …"
Management Principle of Lake Toba Tourism Destination: Local People's Perception,2021,"In tourism development, community participation is very important. Community participation
does not just appear but must start from the correct perception of tourism. The local …"
[PDF] Role of biogas technology adoption in forest conservations: evidence from Ethiopia,2020,"Almost all developing countries satisfy their energy requirements from firewood. In Ethiopia
majority of the rural population relies on biomass energy sources for every energy necessities…"
[PDF] Management of mine acid drainage in a constructed wetland using hyacinth plant and addition of organic materials,2019,"Coal mining is an activity to exploit land to get coal stored underground. Environmental
problems in coal mining activities are generally associated with Acid Mine Drainage (AMD). The …"
"[PDF] Agroedutourism Model to Improve Environmental Awareness of Students in Some Elementary School in Malang Raya, East Java",2016,"This research aimed to build specific agroedutourism model for elementary school students
in Malang Raya. Target of this research were 5th grade students from SDN Ketawanggede 2…"
The impact of land use change on land capability in Tirtomoyo-Wonogiri,2018,"This research was conducted with the aim of studying land use change and evaluating the
impact of land conversion on land capability in Tirtomoyo District of Wonogiri Regency. This …"
[PDF] Selection of mercury accumulator plants for gold mine tailing contaminated soils,2015,"Phytoremediation, which is more efficient with less side effects than conventional physical
and chemical methods, is increasing in popularity as a remediation system. This paper …"
EFL Students' Speaking Anxiety in the Speaking Class (A Survey Study in English Department of Universitas Brawijaya),2019,"… Penelitian ini dilakukan di Departemen Pendidikan Bahasa Inggris Universitas Brawijaya
Malang dengan melibatkan 113 mahasiswa dari semester ketiga yang berasal dari kelas …"
… into Self-Esteem and Work Commitment Levels of Employees Operating within Non-Profit Organization (A Study on AIESEC's Member in Universitas Brawijaya),2018,"… Universitas Brawijaya, dan (2) mengetahui upaya yang diimplementasikan oleh AIESEC
Universitas Brawijaya … selfesteem karyawan di AIESEC Universitas Brawijaya. Sementara itu, …"
"Purple sweet potatoes from East Java of Indonesia revealed the macronutrient, anthocyanin compound and antidepressant activity candidate",2021,"Introduction: The development of new antidepressant is crucial to overcome the remission
rate limitation. Anthocyanin on purple sweet potatoes (PSP) from East Java cultivar previously …"
[PDF] Local Wisdom of Smoked Fish Processing as Tourism Product in Situbondo Regency,2014,"Marine and fisheries resources in Situbondo Regency were potential to supports seafood
processing, eg traditional smoked processing of mackerel tuna (Euthynnus affinis Cantor) …"
[PDF] Evaluation of water quality in the swamp river border using water quality index,2020,"As a source of minerals, water must be continuously maintained, including in term of its quality.
Meanwhile, swamps are wetlands that have the potential to experience a decline in water …"
"[PDF] Urban induced land use land cover changes in upper Deme watershed, Southwest Ethiopia",2021,"Article history: Received 5 June 2021 Accepted 19 July 2021 Published 1 October 2021 The
study was aimed to assess urban induced land use land cover changes in the upper Deme …"
The Influence Water Extract of Black Soybean (Glycine max (L.) Merr.) on Reducing of Blood Glucose Level and The Superoxide Dismutase (SOD) Activity on …,2014,"Black soybean (Glycine max (L.) Merr.) is a tropical plant and spread widely in South East
Asia including Indonesia. It contains anthocyanins and isoflavones which acts commonly as …"
[PDF] Taxonomic Contribution For Ecotourism Development In Indonesia,2013,"This paper describes about the role of taxonomic in ecotourism development in Indonesia.
Development and management of ecotourism in Indonesia recently are still quite slow and …"
Gender Based Motivation In Acquiring Javanese By Non-Javanese First Year Students Of English Study Program Of Universitas Brawijaya,2015,"… studi Sastra Inggris Universitas Brawijaya dalam pemerolehan … Sastra Inggris Universitas
Brawijaya Pendekatan kuantitatif … pertama sastra Inggris Universitas Brawijaya dengan 7 …"
[PDF] Cyanide adsorption from cassava wastewater onto calcined periwinkle shell,2019,"Local cassava processing industries produce large quantities of wastewater containing
cyanide which is toxic in nature with negative impacts on the environment when disposed of …"
"[PDF] Trickle-Down Economics' Arthur Lewis Fails: An Economic Development Study of Mount Bromo in Ngadisari Village, Sukapura District, Probolinggo Regency …",2019,"In this paper, we will examine if the trickle-down effect has ever taken in rural Indonesia.
One of the cases draws attention in economic development study is poverty and income gap …"
[PDF] The economy of tourism and its impact to other sectors in Lampung Province,2016,"Tourism sector has been identified contribute to the economy of Lampung Province. The
study aims to assess the direct and indirect linkage towards economic sectors, analyze the …"
An analysis of face threatening act (FTA) used by the main characters in “Super Nanny” reality show,2011,"Strategi kesantunan adalah cara tuturan yang digunakan dalam komunikasi dengan tujuan
agar interaksi antara penutur dan mitra tutur berjalan lancar. Fenomena sosial ini dapat …"
Volunteers Motivation in Learning Sign Language: A Case Study at CDSS Universitas Brawijaya.,2021,"… Oleh karena itu, penelitian ini bertujuan untuk mengetahui motivasi relawan di Pusat
Studi dan Layanan Disabilitas (PSLD) Universitas Brawijaya dalam belajar bahasa isyarat. …"
[PDF] Influence of Trichoderma as a seed treatment on the growth and yield of groundnut under saline environment,2020,"Agriculture lands in coastal areas face the risk of increasing salinity due to the influence of
sea water. Salinity poses complex problems for plants at all growth stages which are difficult …"
A Correlation Between Vocabulary Mastery And Reading Comprehension Of The English Language Education Students,2016,"… Penelitian ini melibatkan beberapa peserta dari program pendidikan bahasa Inggris di
Universitas Brawijaya. Para peserta dalam penelitian ini adalah 39 siswa dari pendidikan …"
"[PDF] Evaluation of ground arthropod structure in restoration area of Talangagung landfill as edutourism attraction, Kepanjen, Malang",2015,"Aim of this research is to know the composition, community structure and survival of ground
arthropod in restoration area of Talangagung edutourism landfill (TPA Wisata Edukasi …"
Culture development planning in the special region of Yogyakarta (Management planning of cultural heritage in Kotagede District based on community empowerment …,2014,"The Special Region of Yogyakarta is a cultural rich city with excellent cultural resources.
Yogyakarta should manage their assets with long-term planning to keep the sustainability. …"
[PDF] Genetic variation based on RAPD profiling and production loss of cayenne pepper due to periodic flooding,2021,"Cayenne pepper is known as a sensitive plant to water stress, either drought or flooding.
However, not many studies on the plant's response to the naturally occurring periodic flooding …"
[PDF] Alteration agronomic traits performance of sweet potato cultivars from drylands to paddy fields,2019,"This study aimed to evaluate changes in agronomic performances of some sweet potato
cultivars planted in the rain-fed dry land and paddy fields. Completely randomized block design …"
The growth response of pokem (Setaria italica L.) inoculated with arbuscular mycorrhizal fungi (AMF) from tailings area,2021,"The purpose of this research was to study the growth response of pokem (Setaria italica),
which was inoculated by the arbuscular mycorrhizal fungi (AMF) from the tailings area. The …"
Motivation in Language Learning by English L2 Learners in Universitas Brawijaya: Case Study of First Year Students of English Study Program,2019,"… This study aims at examining the types of motivation in English learning by L2 English
learners in Universitas Brawijaya and investigating the degree to which their motivation traits are …"
"Impact of water management on root morphology, growth and yield component of lowland rice varieties under the organic system of rice intensification",2018,"Water management is one of the keys to success in increasing rice production in paddy
fields. Paddy rice production will decrease if the rice plants suffer from water stress, and …"
Compensatory Strategies Used by High and Low Achievers of Study Program of English Universitas Brawijaya: A Qualitative Study.,2016,"… Bahasa Inggris Universitas Brawijaya menggunakan teori … studi yang tinggi dan rendah
Universitas Brawijaya, (2) Apa … Program Bahasa Inggris Universitas Brawijaya. Penelitian ini …"
The Influence of Word of Mouth (WOM) on Revisit Intention: The Mediating Role of Destination Image (Case Study on Domestic Tourists Visiting Mount Bromo),2014,"Tujuan dari penelitian ini adalah untuk mempelajari pengaruh dari mulut ke mulut (WOM),
pada niat Tinjau kembali dengan efek intervensi dari citra tujuan. 100 kuesioner …"
The Students' Perception On Story Telling In Learning Speaking At English Language Education Program Batch 2016 Universitas Brawijaya,2017,"… Pendidikan Bahasa Inggris Angkatan 2016 Universitas Brawijaya. Penelitian ini bertujuan
… Bahasa Inggris angkatan 2016 Universitas Brawijaya. Penelitian ini menggunakan metode …"
Speech Style Used in Thesis Consultation by Students in Faculty of Cultural Studies Universitas Brawijaya.,2015,"… Penulis melakukan studi tentang gaya bicara yang digunakan dalam konsultasi tesis oleh
siswa di Fakultas Studi Budaya, Universitas Brawijaya. Ada dua masalah yang akan dijawab …"
"[PDF] Ethnobiological study of Larung Sembonyo Ceremony in Watulimo District, Trenggalek as a basic of ecotourism planning",2017,"This research aims to describe the ritual plant species and types of offerings that are used in
Larung Sembonyo ceremonies and to know the community's role in the conservation of …"
Language Learning Styles Used By The First Year Students Of English Class Program At Faculty Of Social And Political Sciences Universitas Brawijaya,2017,"… adalah untuk menyelidiki dan memeriksa gaya belajar yang digunakan oleh siswa tahun
pertama program kelas bahasa Inggris di Fakultas Ilmu Sosial dan Politik Universitas Brawijaya…"
"[HTML] Antimicrobial, antioxidant, and cytotoxic activities of endhopitic fungi Chaetomium sp. isolated from Phyllanthus niruri Linn: in vitro and in silico studies",2017,"Endophytic fungi Chaetomium sp isolated from Phyllanthus niruri Linn. Mycelium powder
was extracted by using ethyl acetate. Extract was fractionated using n-hexane, …"
Correlation Between Morphological Awareness And Vocabulary Knowledge In The Third Year Students Of English Study Program Of Universitas Brawijaya,2015,"… Peserta dalam penelitian ini sejumlah 71 murid mahasiswa tahun ketiga, Program Studi
Sastra Inggris, Universitas Brawijaya. Maka, data penelitian ini diperolaeh dari hasil instrument …"
African American Vernacular English (Aave) Comprehension Of English Study Program Students In Universitas Brawijaya,2018,"… Study Program students of Universitas Brawijaya using Wardhaugh’s … Study Program in
Universitas Brawijaya understand AAVE … Study Program of Universitas Brawijaya have an above …"
The Influence of Capital Structure and Asset Management on Profitability and Firm Value (an Empirical Research at Real Estate and Property that Listed in Indonesia …,2015,"Tujuan dari penelitian ini adalah untuk menganalisis pengaruh struktur modal dan manajemen
aset tentang profitabilitas dan nilai tegas real estat dan properti yang tercantum dalam …"
[CITATION] Study of student's intention to use electronic money based on TAM,2019,
[PDF] Phytotoxicity of coal fly ash on plant growth and heavy metal uptake by plant in an acid soil,2020,"Considering the content of various elements in coal fly ash (CFA), it has the potential to be
used as an additional source of nutrients in the soil. However, the use of CFA for agriculture is …"
[PDF] Utilization of indigenous phosphate-solubilizing bacteria to optimize the use of coal fly ash for increasing available-P in an Ultisol,2021,"Article history: Received 15 April 2021 Accepted 31 May 2021 Published 1 July 2021 Coal
fly ash (CFA) is a coal-burning by-product containing macro and micronutrients, and it is the …"
Grammatical Cohesion Found In Discourse Analysis Thesis Abstracts Of Academic Years 2012-2015 From Study Program Of English Universitas Brawijaya,2016,"… penelitian untuk menganalisis kohesi tata bahasa pada abstrak skripsi dalam Analisis
Wacana pada tahun pelajaran 2012 – 2015 program studi Sastra Inggris Universitas Brawijaya. …"
The Interpretation of News Title of Lapindo Mud Case in Metro TV and TV One by Students of Political Science Department at Universitas Brawijaya.,2014,"… one dalam mempengaruhi mahasiswa Ilmu Politik di Universitas Brawijaya. Dalam studi ini,
… one terhadap mahasiswa Ilmu Politik di Universitas Brawijaya? Penelitian ini menggunakan …"
Speaking Strategy Used By A Student With High Achievement In English Language Education Program Batch 2015 Universitas Brawijaya (Case Study),2017,"Berbicara adalah sebuah keterampilan yang memungkinkan pelajar untuk mengekspresikan
makdsud dalam pada sebuah komunikasi. Sayangnya, pembelajar bahasa Inggris …"
"… Used By Visual Impairment Student To Comprehend English Learning Material (A Case Study At English Language Education Program, Universitas Brawijaya)",2016,"Gangguan visual adalah kecacatan yang mempengaruhi fungsi mata, bahwa meskipun
orang tersebut menggunakan lensa korektif, mereka masih memiliki kemampuan penglihatan …"
[PDF] Mining land identification in Wetar Island using remote sensing data,2018,"Wetar Island is one of the 92 outer islands of Indonesia. On this island, there is a variety of
geological potential that can be seen from the structure, formation and geological folds …"
The Correlation Between Speaking Skill And Listening Skill Of Higher Education Students Of Universitas Brawijaya,2018,"Penelitian ini ditujukan untuk mengetahui apakah ada korelasi antara kemampuan berbicara
dan kemampuan mendengar pada mahasiswa universitas brawijaya tahun kedua. Sampel …"
"N, P and K storage efficiency on degraded peat soil through ameliorant application",2014,"The availability of nutrients, especially N, P, K in the degraded peat are very low. The high
organic acids can decrease the soil pH, its causes the negatively charged nutrients such as …"
"Human Resources Competences in Economics Higher Education Provider in East Java, Indonesia: The determinant of organizational performances",2019,"This study seeks to fill a gap (gap) is to integrate human resource competencies, and a culture
of innovation in improving organizational performance and competitiveness, especially in …"
"[PDF] Status of macro and micro nutrients from deposited tailings in reclamation area, PT Freeport Indonesia, Timika",2016,"The reclamation program of deposited tailings (SIRSAT) is the obligation of the mining
concession holder PT Freeport Indonesia (PTFI). The monitoring of soil and plant qualities …"
[PDF] An application of geographic information system to identify the suitability of sea cucumbers (Holothuria scabra) in West Lombok Waters,2017,"This study was conducted on 17th October-27th November 2016 at Gili Asahan, Gili Layar,
and Gili Gede in West Sekotong, Lombok, West Nusa Tenggara. The purpose of this study …"
Gender Based Request Strategies Performed By Customers Of Language Service And Development Center At Universitas Brawijaya Malang,2017,"Laki-laki dan perempuan diharapkan untuk melakukan strategi yang berbeda dalam
menyampaikan keinginan mereka, seperti dalam kalimat permintaan. Laki-laki diharapkan untuk …"
"[PDF] Eco-homestay: Development concept on rural tourism-based conservation model (study case of Sidomulyo Village, Silo District, Jember Regency)",2013,"The purposes of this research were to assess the concept of Eco-Homestay in conservation-based
tourism in rural area. A case study was set up at Sidomulyo Village, Silo District, …"
"[PDF] Maneke as local wisdom in the community of small islands in Sangihe Island Regency, North Sulawesi",2017,"Maneke is one of the local wisdom in Sangihe Islands Regency, inherited from the ancestors
of the people of Sangihe. Maneke contains the norms and values of life and customs to …"
Code Switching Used by Sign Language Interpreter at Fine Art Program Universitas Brawijaya,2017,"… Interaksi tersebut terjadi dalam lingkup pendidikan seperti di Program Studi Seni Rupa
Universitas Brawijaya. Penelitian ini ditujukan untuk mengetahui tipe-tipe alih kode apa yang …"
"[PDF] Evaluation of the effectiveness of level soil bund and soil bund age on selected soil physicochemical properties in Somodo Watershed, Jimma Zone …",2020,"This study was conducted to investigate the effect of level soil bund stabilized with Vetiver
grass and soil bund age on selected soil physicochemical properties on Somodo watershed, …"
The Influence of electronic word of mouth on consumer trustworthiness and purchase intention (Survey on Followers Instagram of@ Zaloraid),2018,"Penelitian ini bertujuan untuk (1) menjelaskan pengaruh Electronic Word of Mouth terhadap
Consumer Trustworthiness, (2) menjelaskan pengaruh Consumer Trustworthiness terhadap …"
… (IMC) on Brand Equity and Purchase Decision (Case Study on Indosat-M3 (IM3) Customers Among Members of Unit Aktivitas Band Universitas Brawijaya Cla,2015,"Penelitian ini bertujuan untuk: (1) untuk menguji pengaruh variabel komunikasi pemasaran
terintegrasi (IMC) pada ekuitas merek, (2) untuk memeriksa pengaruh tidak langsung dari …"
Writing Learning Strategies Used By Deaf High Achievers Academic Year Of 2016/2017 At Universitas Brawijaya,2017,"… adalah sebuah penelitian deskriptif kualitatif yang melibatkan high achievers tuna rungu
tahun ajaran 2016/2017 dalam keterampilan menulis Bahasa Inggris di Universitas Brawijaya. …"
Politeness In Interlanguage Pragmatic Of Complaints By Indonesian EFL Learners In English Language Education Of Universitas Brawijaya,2019,"Memperoleh Bahasa Inggris sebagai Bahasa Asing tidak hanya membutuhkan kompetensi
tata bahasa tetapi juga kompetensi pragmatis. Kompetensi pragmatis membantu pelajar …"
Interlanguage In The Short Story Interpretation: A Case Of The Eighth Semester Students Of English Study Program Of Universitas Brawijaya,2015,"Interlanguage adalah sistem linguistik yang digunakan oleh pembelajar bahasa kedua dan
ini dipengaruhi oleh bahasa pertama. Sangat penting untuk menguasai keahlian bahasa …"
[PDF] Translation Procedures In Writing Thesis Abstract By Faculty Of Law Students In Universitas Brawijaya,2018,"… by the translators in translating thesis abstracts of faculty of law in Universitas Brawijaya. …
by students of Faculty of Law in Universitas Brawijaya. The researcher set several criteria to …"
[PDF] In Vitro and In Silico Study of Immobilized Xylanase from Trichoderma viride using Bentonite Matrices Activated with HCl,2017,"The purpose of this study was aimed determine the optimum conditions of agitation time
and concentration of immobilized xylanase by in vitro and in silico and efficient reuse of …"
Understanding hypocholesterolemic activity of soy isoflavones: Completing the puzzle through computational simulations,2023,"The hypocholesterolemic activity of soy isoflavones has been studied, but the exact mechanism
underlying the activity remains unclear. This study reveals the proposed mechanism of …"
[PDF] English Spelling Errors Committed by A Blind Student at English Language Education Program Universitas Brawijaya.,2017,"… studi pendidikan bahasa Inggris di Universitas Brawijaya. Penelitian ini menggunakan …
This study focus on a blind student in English language department Universitas Brawijaya …"
[PDF] Land degradation is indicative: proxies of forest land degradation in Ghana,2015,"How is land degradation measured? The aim of the paper is to address this research
question. At the premise, the paper states that land degradation as one of the truth claims of …"
[PDF] Water quality evaluation of post-tin mining ponds tourism in Bangka Island Using Diatom as Bioindicator,2019,"Post tin mining pond in Bangka Island has been used as a tourism place, fishing, fish ponds,
and agricultural areas that can reduce water. The purpose of this study is to evaluate the …"
Efl Students' Perceptions Towards The Use Of Self-Video Recording To Decrease Their Speaking Anxiety.,2021,"… Sumber data penelitian ini adalah 100 mahasiswa Program Studi Pendidikan Bahasa Inggris
Universitas Brawijaya angkatan 2017 yang sudah mengambil mata kuliah Micro Teaching …"
"Plagiarism Checker: Model of Ecotourism Management in Small Islands of Bunaken National Park, North Sulawesi",2015,"The Bunaken National Park is one of the famous national park for tourism in North Sulawesi,
Indonesia. The abundance natural resources is one of the crucial natural attraction for …"
[PDF] Analysis Of Accounting Students' Perception On Factors Influencing Career Selection (A Case In Faculty Of Economics And Business Universitas Brawijaya).,2017,"… of Economics and Business Universitas Brawijaya from batch 2012 … study in Universitas
Brawijaya who always give motivation to … Business Universitas Brawijaya because based on the …"
[PDF] Spatial distribution of land susceptibility to degradation and recomendation for its improvement: A case study in the Upper Solo Sub-Watershed,2016,"Spatial distribution of land properties and its susceptibility to degradation is essential for
watershed management planning. Therefore, a study was carried out to assess spatial …"
