Title,Year,Abstract
"Isolation and identification on microorganism decomposers of Palu local cow manure of Central Sulawesi, Indonesia",2016,"Microbial decomposers are living things posessing an important role in outlining materials
derived from organic compounds entering the environment as plant nutrients so that they …"
Registers Used in AIESEC Local Committee of Universitas Brawijaya.,2017,"… LC Universitas Brawijaya beserta artinya… Universitas Brawijaya dan (3) proses apa saja
yang terdapat dalam pembentukan register yang digunakan di AIESEC LC Universitas Brawijaya…"
"[PDF] Seawater intrusion assessment and prediction of sea-freshwater interface in Parangtritis coastal aquifer, South of Yogyakarta Special Province, Indonesia",2021,"Article history: Received 9 January 2021 Accepted 11 February 2021 Published 1 April 2021
The Parangtritis area is a tourist destination in Yogyakarta, Indonesia, consisting of dunes …"
"[PDF] The impact of mangrove damage on tidal flooding in the subdistrict of Tugu, Semarang, Central Java",2021,"Article history: Received 9 July 2021 Accepted 31 July 2021 Published 1 October 2021
Expansion of industrial areas, aquaculture, settlements, and limited knowledge of the community …"
[PDF] Politeness strategies in text messaging (A case study of students' text messages to the lecturers in English study program Universitas Brawijaya),2017,"… To fulfil the needs of this research, the following research problems are formulated: (1) What
are the politeness strategies in requesting and giving information used by English Study …"
Organic amendments effect on the soil chemical properties of marginal land and soybean yield,2020,"Land use change is increasing, causing a lack of optimal land for agriculture. Marginal land
improvement can be made with the application of organic amendments that can improve soil …"
"[PDF] Land suitability evaluation of abandoned tin-mining areas for agricultural development in Bangka Island, Indonesia",2017,"Kepulauan Bangka Belitung, Indonesia is one of the tin mineral-producer in the world.
Agricultural crops could be a wise option for the reclamation since abandoned tin-mining lands …"
Genetic diversity of porang populations (Amorphophallus muelleri Blume) in Central Java and West Java based on LEAFY second intron marker,2016,"Porang (Amorphophallus muelleri Blume) is dispersed and grew well in Java island. This
research aimed to determine the genetic diversity of porang populations in Central Java and …"
"The use of pineapple liquid waste and cow dung compost to improve the availability of soil N, P, and K and growth of pineapple plant in an Ultisol of Central Lampung",2018,"A study that was aimed to elucidate the effect of adding pineapple liquid waste and cow dung
compost in increasing the availability of soil N, P, K, contents of N, P, K in pineapple leaves …"
[PDF] The role of social capital in community based tourism,2019,"The role of social capital in Community-based tourism (CBT) to reach local communities’
welfare is being the concern of tourism activities. Previous research found that social capital …"
Analysis of factors influencing user intention in using Ovo application,2019,"… Responden dalam penelitian ini adalah 322 mahasiswa S1 jurusan akuntansi di Universitas
Brawijaya Malang, yang memiliki pengalaman dalam menggunakan layanan aplikasi OVO. …"
"[PDF] Factors affecting level of participation in the management of mangroves as ecotourism attraction: lesson learned from Cengkrong Watulimo, Trenggalek",2017,"Ecotourism development can not be separated from the social aspects of the people living
around the tourist sites. One indicator that a tourist location is said to be ecotourism-based is …"
Determining Factors of Student's Entrepreneurial Intention in Indonesia: A Meta-Analysis,2019,"This study aims to conduct a meta-analysis on determining factors that affect student’s
entrepreneurial intention. There are a variety of findings from several studies on the influence of …"
[PDF] Estimation of soil erosion for a sustainable land use planning: RUSLE model validation by remote sensing data utilization in the Kalikonto watershed,2015,"Technology of Geographic Information Systems (GIS) and Remote Sensing (RS) are increasingly
used for planning and natural resources management. GIS and RS is based on pixels …"
Utilization of maize cob biochar and rice husk charcoal as soil amendment for improving acid soil fertility and productivity,2014,"The decline in soil fertility in agricultural land is a major problem that causes a decrease in
the production of food crops. One of the causes of the decline in soil fertility is declining soil …"
"[PDF] Copper and arsenic accumulation of Pityrogramma calomelanos, Nephrolepis biserrata, and Cynodon dactylon in Cu-and Au-mine tailings",2020,"Metallophytes are group of plants that can thrive on metal-rich substrate. These plants have
potential in various green technologies. However, it is a must to first identify plants that can …"
Staycation during covid-19 pandemic with virtual tourism: Tele-tourist attitude toward experience in cultural heritage destination,2021,"Malang City, Indonesia, is known as the Paris van oost Java and was officially named the City
of Heritage because of the high interest of domestic and foreign tourists to trace the history …"
Application of bokashi and sunn hemp (Crotalaria juncea L.) to improve inorganic fertilizer efficiency on maize (Zea mays L.),2015,"A field experiment was conducted lo learn about the effect of Bokashi and Sunn hemp (Crotalaria
junceaL.) on maize production and inorganic fertilizer use efficiency on maize. The …"
[PDF] Tourism destination in remote area: problems and challenges of tourism development in North Halmahera as remote and border areas of Indonesia-Philippines,2018,"This paper will describe the problems and challenges in North Halmahera tourism development
and describe the coordination, resources, disposition of executor and bureaucratic …"
"The Influence Of Perceived Usefulness, Ease Of Use, Trust, And Risk Towards Gojek Actual Usage With Behavioral Intention To Use As Intervening Variable",2019,"… Responden dalam penelitian ini adalah 581 mahasiswa aktif jurusan akuntansi Fakultas
Ekonomi dan Bisnis, Universitas Brawijaya tahun akademik 2015 dan 2016. Data penelitian …"
Students' Attitude Towards Group Work Assignment Through Final Project In English Language Education Study Program Universitas Brawijaya,2016,"… program studi pendidikan bahasa Inggris Universitas Brawijaya. Penelitian ini menggunakan
… 6 dan 8 Fakultas Studi Budaya, Universitas Brawijaya Malang. Instrumen yang digunakan …"
[PDF] Utilization of LCC (Legume Cover Crop) and bokashi fertilizer for the efficiency of Fe and Mn uptake of former coal mine land,2018,"Coal mining activities have a negative impact on the ecosystem and lead to the disruption of
the environment due to waste disposal containing a high concentration of Fe and Mn. In …"
Characterization of phosphate solubilizing bacteria isolated from Pb contaminated soils and their potential for dissolving tricalcium phosphate,2014,"Phosphorus solubilizing bacteria (PSB) enhances P availability in soils through dissolving
inorganic P pools. The characteristics of PSB and the potential of three Pb tolerant phosphate …"
"Effects of land use on soil degradation in Giriwoyo, Wonogiri, Indonesia",2021,"This study aimed at determining the effect of land use on soil degradation, discovering the
indicator as a determinant factor of soil degradation, and providing recommendations for land …"
"[PDF] Productivity evaluation of Eucalyptus urophylla plantation established in dryland ecosystems, East Nusa Tenggara",2020,"The establishment of the Eucalyptus urophylla plantation has a potential contribution to the
improvement of dryland ecosystem productivity in East Nusa Tenggara. However, the …"
"A critical assessment of community-based tourism practices in Nglanggeran Ecotourism Village, Indonesia",2021,"This study investigates the strategic managerial practices to overcome the developmental
challenges of CBT in the Nglanggeran Ecotourism Village in Yogyakarta, Indonesia. It …"
[PDF] Exploring the potential roles of biochars on land degradation mitigation,2014,"Land degradation was exacerbated and its management was challenged by population growth
and global climate change. The impacts of land degradation on food security, ecosystem …"
"… Ease Of Use, Usefulness, Benefit And Satisfaction In Ovo Electronic Payment (A Case Study On Faculty Of Economics And Business At Universitas Brawijaya)",2019,"Penelitian ini bertujuan untuk menguji pengaruh persepsi risiko, persepsi kemudahan
penggunaan, persepsi manfaat, persepsi manfaat pada persepsi kepuasanyang menggunakan …"
"[PDF] Impact of sand mining on the changes of morphological and physical dynamics in Sa'dang River, Pinrang District, Indonesia",2020,"The research aimed to investigate the morphological changes and physical dynamics
conditions of the Sa’dang River associated with river sand mining activities. The research is …"
"[PDF] The potential of butterflies in tourism diversification product: Case study at Coban Rais waterfall, Batu, East Java",2016,"The diversity of Butterfly in Coban Rais is one of the potential resources for tourism product
diversification and development. The aims of this paper are to determine the magnitude of …"
"[PDF] Application of manure, nitrogen fertilizer, and EM4 to improve growth and yield of red chili (Capsicum annuum L) on an Alfisol",2016,"Red chili is commodity of vegetable that has high economic value, but still has low
productivity. The objective of this study was to elucidate the effect of goat manure and Urea …"
[PDF] Gas chromatographic analysis of medium chain fatty acids in coconut oil,2016,"ABSTRACT Analysis of medium chain of fatty acids in coconut oil becomes important due to
their roles in health issues. The present analysis methods for fatty acids present in food …"
"[PDF] Ecotourism Development Strategy of Bukit Jaddih Karst, Madura",2018,"Bukit Jaddih karst in Bangkalan, Madura, is an ex-limestone mining location managed
partially by individuals or community groups as tourism area. This study aims to develop …"
Utilization of organic fertilizer to increase paddy growth and productivity using System of Rice Intensification (SRI) method in saline soil,2016,"Soil salinity has negative effect on soil biodiversity as well as microbial activities. Hence, rice
growth also effected by salinity. Application of organic fertilizer and adoption of System of …"
Real-Time Energy Monitoring and Management in Educational Institutions: A Case Study of Universitas Brawijaya,2024,"Energy consumption in educational institutions, particularly universities, represents a
significant portion of operational costs and has substantial environmental impacts. This study …"
[PDF] Electric charge characteristics of biofilms formed on various surfaces,2016,"Biofilm is predominant habitats of microbes in aquatic environments. Biofilm forms when
microbes attach on surfaces and produce extracellular polymeric substances. Biofilm matrix has …"
Developing A Content-Based Syllabus Of English For The Study Program Of Development Economics Universitas Brawijaya,2017,"Penelitian ini bertujuan untuk mengembangkan silabus mata kuliah bahasa Inggris untuk
program studi Ekonomi Pembangunan Universitas Brawijaya. Untuk mencapai tujuan tersebut…"
"[PDF] Effect of gypsum and cow manure on yield, proline content, and K/Na ratio of soybean genotypes under saline conditions",2018,"Gypsum and cow manure potential as ameliorant to increase crop production under salt stress
or saline condition. This research aimed to learn the effect of gypsum and cow manure on …"
"Comparison of DNA extraction methods between conventional, kit, alkali and buffer-only for PCR amplification on raw and boiled bovine and porcine meat",2017,"Detection of porcine contamination in food material by employing PCR techniques is integral
in halal food confirmation. However, PCR is both costly and laborious, particularly in DNA …"
Effect of calcination at synthesis of Mg-Al hydrotalcite using co-precipitation method,2017,"The use of hydrotalcite in catalysis has wide attention in academic research and industrial
parties. Based on its utilization, hydrotalcite can be active catalyst or support. This research is …"
"[PDF] Effects of Pseudomonas fluorescens and sulfur on nutrients uptake, growth and yield of groundnut in an alkaline soil",2016,"The aim of this research was to study the influence of P. fluorescens and sulfur on nutrients
uptake, growth and yield of groundnut in alkaline soil. The experiment was conducted in the …"
[PDF] Integration of the latest digital terrain model (DTM) with Synthetic aperture radar (SAR) bathymetry,2021,"Article history: Received 12 December 2020 Accepted 3 March 2021 Published 1 April 2021
Topography and bathymetry integration is one of the essential things in providing height …"
"Adaptability of some legume trees on quartz tailings of a former tin mining area in Bangka Island, Indonesia",2016,"Tin mining activities in Bangka Island, besides their important role in contributing to state
revenues, also caused damage to the environment, among others in the form of quartz tailings …"
"[PDF] The effect of tillage systems and dosages of cow manure on weed and soybeans yield (Glycine max, Merrill)",2019,"A field experiment to elucidate the effect of tillage systems and dosages of cow manure on
weed and soybeans yield (Glycine max, Merrill) was conducted at the Agrotechno Park of the …"
"[PDF] The role of women in Lok Baintan Floating Market, South Kalimantan: implication for tourism development",2017,"Lok Baintan Floating Market is the tourism destination in South Kalimantan. Trading activity
in Lok Baintan become the tourism attraction, which traders in the Floating Market are …"
"[PDF] River, Culture and Tourism in Lok Baintan, South Kalimantan",2016,"River become integral part of the Banjarese live in Lok Baitan, South Kalimantan. The
economic value of the river has been reported very high. Rivesr is a habitat for numerous fishes …"
"The evaluation of incentive-disincentive system in tourism development: a case study of Lake Linow development, Tomohon, North Sulawesi",2016,"The aim of the research is to evaluate the implementation of incentive-disincentive system
which area implemented in Lake Linow in term of tourism development. This result confirm …"
Potency and Diversity of Fungi on Pine Litter and Rhizosphere in Different Land-use of Universitas Brawijaya (UB) Forest,2022,"The agroforestry system with its diversity of vegetation has the potential on the existence of
antagonistic and entomopathogen fungi. This study was conducted to evaluate the diversity …"
"Land suitability evaluation of shallot (Allium ascalonicum L.) at production centres in Losari District, Brebes",2018,"The demand for shallots is getting higher as the population grows. Indonesia targets to become
a self-sufficient country of onion and the largest exporter of shallots in ASEAN by 2045. …"
"[PDF] Effect of soil and water conservation on rehabilitation of degraded lands and crop productivity in Maego watershed, North Ethiopia",2018,"Many soil and water conservation (SWC) measures have been carried out to solve land
degradation problems in Ethiopia. However, evaluation of their performance is essential to …"
… Writing Achievement (A Correlation Study At The 2nd Semester Of English Language Education Program (Elep) Students Of Universitas Brawijaya In Academic Year …,2017,"Tatabahasa dan menulis adalah komponen bahasa dan kecakapan yang harus dipelajari
pembelajar bahasa. Tatabahasa adalah peraturan atau sistem yang mengatur struktur dan …"
Influence of work discipline and work motivation on employee performance (Study on Universitas Brawijaya Malang Republic of Indonesia Employee Cooperative),2021,"The purpose of this study is to (1) examine and explain the influence of work motivation on
employee performance,(2) examine and explain the influence of work discipline on employee …"
Exploring Islamic Leadership on SME Performance: Mediated by Innovative Work Behavior and Financial Technology,2021,"The current condition of the Indonesian economy is far different from that of the economy ten
years ago. One of the differences in the structure and construction of the Indonesian …"
Students' Errors in Pronouncing English Vowels: A Case Study of the First Year Students of English Study Program of Faculty of Culture Studies,2011,"… Sampel dalam penelitian ini adalah 39 mahasiswa tahun ajaran pertama di 13 kelas
Academic Speaking Fakultas Ilmu Budaya Universitas Brawijaya. Dalam data analisis, peneliti …"
[PDF] The potential of bitter leaf (Vernonia amygdalina) in herbal medicine as anti-inflammatory Agent,2023,"Proses inflamasi melibatkan peningkatan permeabilitas vaskular, denaturasi protein, dan
perubahan membran. Flavonoid merupakan senyawa metabolit sekunder dengan aktivitas …"
The Effect Of Financial Leverage on Firm Value and Market Risk (Research on Consumer Goods Industries Listed in Indonesian Stock Exchanges in the Year of 2010 …,2014,"Perusahaan memproduksi barang untuk mendapatkan target laba. Sebuah perusahaan
memperoleh laba dari total pendapatan dikurangi biaya produksi yang dikeluarkan oleh …"
"[PDF] Potential rainwater harvesting suitable land selection and management by using GIS with MCDA in Ebenat District, Northwestern Ethiopia",2020,"Rainwater harvesting (RWH) is the way to reduce the effects of mid-season dry spells and
drought, which often reduce crop yields. Geographic information system (GIS) with multi-…"
[PDF] The use of ash and biochar derived oil palm bunch and coal fly ash for improvement of nutrient availability in peat soil of Central Kalimantan,2021,"Article history: Received 25 December 2020 Accepted 3 February 2021 Published 1 April
2021 The increment of peat soil productivity meets through ameliorant addition. Ameliorant …"
"Effects of integrated use of grass strip and soil bund on soil properties, Southern Ethiopia",2019,"Soil degradation is the major environmental and agricultural production problem in the highlands
of Ethiopia. The objectives of the study were to examine farmers’ use of grass strip and …"
"[PDF] Reflective practice in stimulating professional growth of English department lecturers of Universitas Brawijaya, Indonesia",2013,"… by the English Department lecturer(s) of Universitas Brawijaya. In addition, the variables of
… of 3 male and 12 female English Department lecturers of Universitas Brawijaya (n=15). 4 of …"
[PDF] The dynamics of shoreline change analysis based on the integration of remote sensing and geographic information system (GIS) techniques in Pekalongan …,2019,"Coastal areas are found in the dynamic zone at the interface between the three major natural
systems of the Earth's surface. The phenomenon of shoreline change is one of the most …"
Phytoremediation of tapioca wastewater using water hyacinth plant (Eichhornia crassipes),2015,"The objective of this study was to elucidate the possible phytoremediation of liquid waste of
tapioca industry using Eichhornia crassipes prior its usage for watering maize grown on an …"
"[PDF] Artisanal and small-scale mining activities as post-mining land use in abandoned mine sites: a case of Giyani and Musina areas, Limpopo Province of South …",2021,"Article history: Received 11 March 2021 Accepted 27 March 2021 Published 1 April 2021
South Africa has many artisanal and small-scale mining (ASM) activities that some are …"
"[PDF] Exploration of marine tourism in Watulimo, Trenggalek Regency: challenges, potentials, and development strategies",2017,"Watulimo District, Trenggalek Regency is one of the area in East Java Province that has an
abundant marine potential. However, this huge potential has not been optimally developed …"
Glyphosate biodegradation by plant growth promoting bacteria and their effect to paddy germination in glyphosate contaminated soil,2017,"Glyphosate is the most widely used herbicide in Indonesia. Glyphosate persistence
between 55 days to 3 years. Widespread and uncontrolled use can cause weeds to become …"
The effect of ameliorants on improvement of soil fertility in post gold mining land at West Kalimantan,2017,"The application of ameliorant has been suggested to improve soil fertility and crop growth in
post illegal gold mining (PIGM) lands. This study evaluated the effect of ameliorant types …"
"[PDF] Antibacterial activity test, evaluation of pharmacognosy and phytochemical screening of some extracts of globe amaranth (Gomphrena globosa)",2017,"Indonesia is a rich biodiversity country where various medicinal plants have existed. One
species of medicinal plants is Globe Amaranth (Gomphrena globosa, Amaranthaceae). This …"
"[PDF] Inventory of invasive plant species along the corridor of Kawah Ijen nature Tourism Park, Banyuwangi, East Java",2014,"A field survey was conducted in November 2013 to inventory invasive plant species present
along the corridor of Kawah Ijen Nature Tourism Park exploratively. Result showed that …"
[PDF] Development of Accounting and Budget System of General Services Board in Universitas Brawijaya: Study of Interpretive,2014,"… of general service board Universitas Brawijaya using the … of general service board Universitas
Brawijaya done today. This … of general service board Universitas Brawijaya is to meet the …"
[PDF] The potential use of indigenous nickel hyperaccumulators for small-scale mining in The Philippines,2013,"Uptake of nickel and three other heavy metals (copper, cobalt, and chromium) was examined
in 33 species of the common and rare native vascular plants growing in an ultramafic area …"
[PDF] Push and pull motivations on halal tourism,2020,"The purpose of this study was to examine empirically the causal relationships among push
and pull travel motivations, destination image, and tourists' travel satisfaction on halal tourism…"
Socio economic impacts and policy of artisanal small-scale gold mining in relation to sustainable agriculture: a case study at Sekotong of West Lombok,2017,"Artisanal and small scale gold mining (ASGM) activities at Sekotong Sub District, West Lombok
District, West Nusa Tenggara which use a traditional system have been operating since …"
[PDF] Application of drip irrigation technology for producing fruit of Salak 'Gula Pasir”(Salacca zalacca var. Gulapasir) off season on dry land,2014,"Naturally, Salak Gula Pasir (Salacca zalacca var. Gula Pasir) is flowering every three months
or four times a year, but only one or two flowering seasons that the flowers can develop into …"
[PDF] Structural modelling of riparian tree diversity and ecosystem degradation roles in determining the water quality of springs and its drains in East Java,2020,"This research was aimed to study the role of riparian trees and ecosystem degradation to
determine water quality in some springs and its channels located in East Java. The research …"
Effects of arbuscular mycorrhiza inoculation on growth and yield of tomato (Lycopersicum esculentum Mill.) under salinity stress,2015,"Objective of the research was to study the effect mycorrhiza on growth and yield of tomato.
The experiment was conducted in screen house 14 mx 10.5 m, in Pasuruan on November …"
[PDF] EFL Learning Strategies of Successful Students of Vocational Program At Universitas Brawijaya,2020,"… study aims to investigate kinds of learning strategies that have been implemented by successful
students majoring in Hotel Management at Vocational Program of Universitas Brawijaya. …"
"[PDF] Development of Community-Based Tourism in Pinusan Kragilan, Pogalan Village, Magelang Regency, Central Java, Indonesia",2019,"The purpose of this study is to describe community involvement in the development of
Kragilan Top Selfie Pinusan tourist destinations (TSPK) and explain the role of Tourism …"
Humification degree and its relationship with some soil physical characteristics on robusta coffee (Coffea canephora) plantation,2016,"Soil moisture stress in coffee plant impacts on the productivity of coffee fruit at PT. Perkebunan
Nusantara XII, it is because the low ability of the soil to store water. The ability of the soil to …"
Negative Marketing in the Cosmetics Industry: The Effect of Greenwashing Perceptions on Purchase Intention Through Brand Image,2022,"With the rise of the sustainable lifestyle movement, the Javanese people are becoming more
aware of the need to buy environmentally friendly products, especially cosmetics. The facts …"
The effect of juice mangosteen rind (Garcinia mangostana L.) to blood sugar levels and histological of pancreatic rats with the induction of streptozotocin,2014,"Diabetes Mellitus (DM) is a chronic metabolic disorder characterized by high blood sugar
levels as a result of insufficiency of insulin function. Xanton a bioactive compound in the …"
[PDF] Anti-implantation activity of kepel (Stelechocarpus burahol) pulp ethanol extract in female mice,2015,"Kepel (Stelechocarpus burahol) has been used as a contraceptive remedy in Indonesian
traditional Javanese royal family. It fruit contains a toxic substances to fetus. However, few …"
[PDF] The effect of biogas slurry and inorganic fertilizer on soil fertility and yield of cucumber (Cucumis sativus L.),2019,"Combining the application of organic manure with inorganic fertilizer treatment can improve
the productivity of the cucumber. Biogas slurry is synthesized from organic manure that can …"
